151;Wędka muchowa Echo Full Spey dwuręczna;https://flyhouse.pl/pl/wedki-muchowe-echo-dwureczne/wedka-muchowa-echo-full-spey-dwureczna.html#/50-klasa-6/66-dlugosc-13_396cm/74-akcja-med_fast/79-czesci-4/589-modele_wedek_echo_th-6130;14;https://flyhouse.pl/3844-large_default/wedka-muchowa-echo-full-spey-dwureczna.jpg,https://flyhouse.pl/3845-large_default/wedka-muchowa-echo-full-spey-dwureczna.jpg,;Wędka Spey o pełnej długości i szybkiej akcji. Pomimo trendów skracania wszystkiego w świecie wędek dwuręcznych, zawsze będzie miejsce na wędki pełnowymiarowe.  Wykorzystując wieloletnie doświadczenie w projektowaniu wędek spey oraz wiedzę mistrza w rzucaniu spey Mariusza Wróblewskiego,  ECHO wyprodukowało swoje najbardziej zaawansowane wędki spey, jakie kiedykolwiek wyprodukowało. Akcja i długość nowoczesnych linek spey. Linki spey ewoluowały od czasu, gdy stały się popularne, jednak wędki pozostały w dużej mierze takie same.  Dlatego ECHO zaczęło od zera, aby znaleźć idealną elastyczność i długość,  aby najskuteczniej łowić najpopularniejsze obecnie rodzaje linek dwuręcznych. Najlżejsza, najbardziej zaawansowana seria dwuręczna ECHO do tej pory. Jako część większej rodziny nowych wędek spey (Full Spey, Compact Spey, Trout Spey),  te nowe wędki są dostosowane do sposobu, w jaki dzisiejsi wędkarze łowią na wędki dwuręczne.  Full Spey ma standardową długość 13′ w 6wt, 7wt i 8wt, idealną na większe sytuacje wodne. Blank: Lekki, o wysokim module. Akcja: Średnio-szybka. Duszka: Pokrowiec na wędkę i tuba pokryte materiałem. Przelotki: Przelotki SIC Stripping i przelotki Snake Hard Chrome. Uchwyt kołowrotka: Anodowane aluminium. ECHO FULL SPEY 13'0" / 396 cm #6 Spey Rod. waga ok. 193 g ECHO FULL SPEY 13'0" / 396 cm #7 Spey Rod. waga ok. 198 g ECHO FULL SPEY 13'0" / 396 cm #8 Spey Rod. waga ok. 205 g ;2935.00 ;;;1;1;1;1;0;0;0;0;
152;Wędka muchowa Echo Compact Spey dwuręczna;https://flyhouse.pl/pl/wedki-muchowe-echo-dwureczne/wedka-muchowa-echo-compact-spey-dwureczna.html#/50-klasa-6/65-dlugosc-12_366cm/74-akcja-med_fast/79-czesci-4/592-modele_wedek_echo_th-6120;14;https://flyhouse.pl/3847-large_default/wedka-muchowa-echo-compact-spey-dwureczna.jpg,https://flyhouse.pl/3849-large_default/wedka-muchowa-echo-compact-spey-dwureczna.jpg,;Nowoczesna akcja spey w kompaktowej długości. W związku z tym, że trendy w nowoczesnych linkach spey stają się coraz bardziej kompaktowe,  nadszedł czas, aby zaprojektować wędki z myślą o tych nowych linkach.  Wykorzystując nasze wieloletnie doświadczenie w projektowaniu wędek spey oraz wiedzę mistrza rzutów spey Mariusza Wróblewskiego,  wyprodukowaliśmy nasze najbardziej zaawansowane wędki spey, jakie kiedykolwiek wyprodukowaliśmy. Akcja i długość nowoczesnych kompaktowych linek spey. Linki spey ewoluowały od czasu, gdy stały się popularne, jednak wędki pozostały w dużej mierze takie same.  Zaczęliśmy więc od zera, aby znaleźć idealną elastyczność i długość,  aby najskuteczniej łowić najpopularniejsze obecnie typy kompaktowych linek dwuręcznych. Najlżejsza, najbardziej zaawansowana seria dwuręczna ECHO do tej pory. Jako część większej rodziny nowych wędek spey (Full Spey, Compact Spey, Trout Spey),  te nowe wędki są dostosowane do sposobu, w jaki dzisiejsi wędkarze łowią na swoje dwuręczne wędki.  Compact Spey ma standardową długość 12′ w 6wt, 7wt i 8wt, idealną do nowoczesnych kompaktowych linek spey. Konstrukcja czteroczęściowa Blank: lekki, o wysokim module sprężystości Akcja: średnio-szybka Tuba: pokrowiec i tuba pokryta materiałem Przelotki: przelotki SIC stripping i przelotki typu snake z twardego chromu Uchwyt kołowrotka: anodowane aluminium ECHO COMPACT SPEY 12'0" / 365 cm #6 Spey Rod. waga ok. 165 g ECHO COMPACT SPEY 12'0" / 365 cm #7 Spey Rod. waga ok. 170 g ECHO COMPACT SPEY 12'0" / 365 cm #8 Spey Rod. waga ok. 178 g ;2965.00 ;;;1;1;1;1;0;0;0;0;
153;Wędka muchowa Echo Trout Spey dwuręczna;https://flyhouse.pl/pl/wedki-muchowe-echo-dwureczne/wedka-muchowa-echo-trout-spey-dwureczna.html#/7-klasa-2/64-dlugosc-11_335cm/74-akcja-med_fast/79-czesci-4/595-modele_wedek_echo_th-2110;14;https://flyhouse.pl/3852-large_default/wedka-muchowa-echo-trout-spey-dwureczna.jpg,https://flyhouse.pl/3850-large_default/wedka-muchowa-echo-trout-spey-dwureczna.jpg,;Wędka, która otwiera zupełnie nowy świat dla wędkarzy łowiących pstrągi. Nowa wędka Trout Spey jest przeznaczona na okres, gdy owady nie wylęgają się,  a Ty chcesz objąć jak największą powierzchnię wody prezentacją pod powierzchnią. Skromna moc i akcja dla maksymalnej wszechstronności. Wędka Trout Spey jest lekka i dostosowana do znacznie więcej niż tylko dwuręcznego wymachu.  z głowicami Skagit i Scandi: odrzucaj emergera ze szczytówki,  wykonaj mending kilometr linki za pomocą zestawu z nimfą wskaźnikową,  nimfą na żyłce, łowij na muchę suchą i wszystko inne, czego możesz potrzebować na ciągle zmieniających się łowiskach pstrągów. Nasza najbardziej zaawansowana seria dwuręczna do tej pory ściśle powiązana z innymi flagowymi wędkami dwuręcznymi, Full Spey i Compact Spey,  wędka Trout Spey jest częścią najbardziej zaawansowanej serii wędek Spey, jakie kiedykolwiek wyprodukowała firma ECHO. Konstrukcja czteroczęściowa Grafit: lekki, o wysokim module Akcja: średnio-szybka Tuba: kwadratowy pokrowiec na wędkę pokryty tkaniną. Przelotki: wytrzymałe chromowane przelotki typu snake. Uchwyt kołowrotka: anodowany uchwyt kołowrotka z czarnego aluminium. ECHO TROUT SPEY 11'0" / 335 cm #2, waga ok. 142 g ECHO TROUT SPEY 11'0" / 335 cm #3, waga ok. 150 g ECHO TROUT SPEY 11'0" / 335 cm #4, waga ok. 165 g ;2695.00 ;;;1;1;1;1;0;0;0;0;
154;Wędka muchowa Echo TR Spey dwuręczna;https://flyhouse.pl/pl/wedki-muchowe-echo-dwureczne/wedka-muchowa-echo-tr-spey-dwureczna.html#/8-klasa-3/64-dlugosc-11_335cm/74-akcja-med_fast/79-czesci-4/596-modele_wedek_echo_th-3110;14;https://flyhouse.pl/3853-large_default/wedka-muchowa-echo-tr-spey-dwureczna.jpg,https://flyhouse.pl/994-large_default/wedka-muchowa-echo-tr-spey-dwureczna.jpg,;Szybka akcja dwuręcznej wędki Tima. Zbudowana z solidnym dolnikiem do nagłych, mocnych zastosowań z dołu.  Rzucaj głowicami Skagit, używając pływających linek do tonących końcówek. Konstrukcja czteroczęściowa Blank: Błyszcząca zieleń Akcja: Med Fast + Duża tuba: Pokryty materiałem pokrowiec na wędkę. Przelotki: Czarne paski i przelotki snake. Uchwyty: Posiada trzy style uchwytów z kompozytowymi wkładkami i punktami nacisku Uchwyt kołowrotka: Czarny anodowany uchwyt kołowrotka ECHO TR2 11'0" / 335 cm #3 Spey Rod, waga ok. 158 g ECHO TR2 11'3" / 344 cm #4 Spey Rod, waga ok. 167g ECHO TR2 12'6" / 384 cm #6 Spey Rod, waga ok. 230g ECHO TR2 13'0" / 396 cm #7 Spey Rod, waga ok. 252g ECHO TR2 13'6" / 414 cm #8 Spey Rod, waga ok. 272g ;2095.00 ;;;1;1;1;1;0;0;0;0;
155;Wędka muchowa Echo King;https://flyhouse.pl/pl/wedki-muchowe-echo-dwureczne/wedka-muchowa-echo-king.html#/53-klasa-9/66-dlugosc-13_396cm/74-akcja-med_fast/79-czesci-4/598-modele_wedek_echo_th-9130;14;https://flyhouse.pl/990-large_default/wedka-muchowa-echo-king.jpg,https://flyhouse.pl/991-large_default/wedka-muchowa-echo-king.jpg,;Echo King ;2695.00 ;;;1;1;1;1;0;0;0;0;
156;Wędka muchowa Echo SR dwuręczna;https://flyhouse.pl/pl/wedki-muchowe-echo-dwureczne/wedka-muchowa-echo-sr-dwureczna.html#/8-klasa-3/18-akcja-fast/58-dlugosc-10_6_320cm/79-czesci-4/603-modele_wedek_echo_th-3106;14;https://flyhouse.pl/3856-large_default/wedka-muchowa-echo-sr-dwureczna.jpg,https://flyhouse.pl/3855-large_default/wedka-muchowa-echo-sr-dwureczna.jpg,;Szybkie akcje i uniwersalne klasy sprawiają, że seria SR to najlepsza wędka dla dwuręcznych wędkarzy,  którzy wolą krótszą wędkę. Modele #3-5 są idealne do łowienia pstrągów i troci morskich wszędzie,  podczas gdy #6-8 radzą sobie z większymi rybami anadromicznymi z autorytetem. Elegancki wygląd  i niezniszczalne komponenty pomagają umocnić pozycję SR jako najbardziej rybnej wędki switch. Konstrukcja czteroczęściowa Blank: Szary ciemny połysk Akcja: Szybka Rura: Pokryty materiałem pokrowiec na wędkę i skarpeta Przelotki: Twarde chromowane przelotki jednostopkowe Uchwyty: Posiada dwa rodzaje uchwytów z wkładkami kompozytowymi Uchwyt kołowrotka: Czarny anodowany uchwyt kołowrotka ECHO SR 10'6" / 323 cm #3 Switch, waga ok. 164 g ECHO SR 10'6" / 323 cm #4 Switch, waga ok. 170g ECHO SR 10'8" / 329 cm #5 Switch, waga ok. 180g ECHO SR 10'10" / 308 cm #6 Switch, waga ok. 190g ECHO SR 10'10" / 308 cm #7 Switch, waga ok. 198g ECHO SR 10'10" / 308 cm #8 Switch, waga ok. 200g ;1855.00 ;;;1;1;1;1;0;0;0;0;
157;Wędka muchowa Echo Swing Spey dwuręczna;https://flyhouse.pl/pl/wedki-muchowe-echo-dwureczne/wedka-muchowa-echo-swing-spey-dwureczna.html#/50-klasa-6/74-akcja-med_fast/79-czesci-4/621-dlugosc-11_6_350cm/627-modele_wedek_echo_th-6116;14;https://flyhouse.pl/3858-large_default/wedka-muchowa-echo-swing-spey-dwureczna.jpg,https://flyhouse.pl/998-large_default/wedka-muchowa-echo-swing-spey-dwureczna.jpg,;Mieć ciastko i je zjeść !! Wędki ECHO Swing Trout-Spey, Switch i Spey charakteryzują się ostrymi akcjami  i idealną mocą, aby dopasować się do szerokiego zakresu ruchów rzutowych i sytuacji wędkarskich  bez nadwyrężania budżetu. Unikalne rozmiary wędzisk Switch są dostosowane do prawdziwych sytuacji wędkarskich,  w których potrzebujesz poważnego kręgosłupa, ale nie masz miejsca na pełnowymiarowego speya.  Trout-Spey to nowość na rok 2024. Swing, jazda na łyżwach lub rzucanie spławikami na pstrągi,  trocie morskie lub łososie, nowy Swing jest gotowy do gry. Konstrukcja czteroczęściowa Blank: Błyszcząca niebieska stal Akcja: Średnio-szybka Tuba: Pokryty materiałem pokrowiec na wędkę Przelotki: Przelotki SIC Stripping i twarde chromowane przelotki Snake Uchwyty: Posiada 2 style uchwytów Uchwyt kołowrotka: Anodowane aluminium ECHO SWING 12'6" / 384 cm #6 Spey, waga ok. 226 g. ECHO SWING 13'0" / 396 cm #7 Spey, waga ok. 250 g ECHO SWING 13'6" / 414 cm #8 Spey, waga ok. 280 g ;1650.00 ;;;1;1;1;1;0;0;0;0;
158;Wędka muchowa Echo Swing Switch dwuręczna;https://flyhouse.pl/pl/wedki-muchowe-echo-dwureczne/wedka-muchowa-echo-swing-switch-dwureczna.html#/50-klasa-6/74-akcja-med_fast/79-czesci-4/621-dlugosc-11_6_350cm/627-modele_wedek_echo_th-6116;14;https://flyhouse.pl/3864-large_default/wedka-muchowa-echo-swing-switch-dwureczna.jpg,https://flyhouse.pl/3862-large_default/wedka-muchowa-echo-swing-switch-dwureczna.jpg,;Mieć ciastko i je zjeść !! Wędki ECHO Swing Trout-Spey, Switch i Spey charakteryzują się ostrymi akcjami  i idealną mocą, aby dopasować się do szerokiego zakresu ruchów rzutowych i sytuacji wędkarskich  bez nadwyrężania budżetu. Unikalne rozmiary wędzisk Switch są dostosowane do prawdziwych sytuacji wędkarskich,  w których potrzebujesz poważnego kręgosłupa, ale nie masz miejsca na pełnowymiarowego speya.  Trout-Spey to nowość na rok 2024. Swing, jazda na łyżwach lub rzucanie spławikami na pstrągi,  trocie morskie lub łososie, nowy Swing jest gotowy do gry. Konstrukcja czteroczęściowa Blank: Błyszcząca niebieska stal Akcja: Średnio-szybka Tuba: Pokryty materiałem pokrowiec na wędkę Przelotki: Przelotki SIC Stripping i twarde chromowane przelotki Snake Uchwyty: Posiada 2 style uchwytów Uchwyt kołowrotka: Anodowane aluminium ECHO SWING 11'6" / 354 cm #6 Switch, waga ok. 207 g. ECHO SWING 11'7" / 357 cm #7 Switch, waga ok. 218 g ECHO SWING 11'8" / 360 cm #8 Switch, waga ok. 224 g ;1650.00 ;;;1;1;1;1;0;0;0;0;
159;Wędka muchowa Echo Boost Beach dwuręczna;https://flyhouse.pl/pl/wedki-muchowe-echo-dwureczne/wedka-muchowa-echo-boost-beach-dwureczna.html#/18-akcja-fast/50-klasa-6/65-dlugosc-12_366cm/79-czesci-4/592-modele_wedek_echo_th-6120;14;https://flyhouse.pl/3866-large_default/wedka-muchowa-echo-boost-beach-dwureczna.jpg,https://flyhouse.pl/1002-large_default/wedka-muchowa-echo-boost-beach-dwureczna.jpg,;Wędka zaprojektowana do rzucania z góry na dwie ręce. Pierwsza w swoim rodzaju: dwuręczna wędka specjalnie zaprojektowana do rzucania z góry na dwie ręce.  Podczas gdy większość dwuręcznych wędek jest budowana z myślą o rzucaniu spey,  unikalna konstrukcja Boost Beach została stworzona z myślą o rzucaniu z plaży. Rzucaj ciasne pętle z mniejszym wysiłkiem. Wędki spey są zaprojektowane tak, aby ładować się głęboko w blank, aby prawidłowo wystrzelić zakotwiczony rzut spey  Boost Beast przełamuje ten trend na rzecz akcji i równowagi mocy, która pozwala na dużą prędkość linki,  ciasne rzuty z pętli przy użyciu znacznie mniejszego wysiłku niż tradycyjna dwuręczna wędka. Uważajcie, trocie morskie i szczupaki! Niezależnie od tego, czy polujesz na słonego szczupaka u wybrzeży południowej Szwecji,  troć morską na duńskim archipelagu czy okonia morskiego u zachodniego wybrzeża Irlandii. Blank: Stealth Matte Black Akcja: Fast Tuba: Pokrowiec na wędkę i tuba pokryty materiałem Przelotki: typu snake  Uchwyt kołowrotka: Czarny anodowany uchwyt kołowrotka ECHO BOOST BEACH 12'0" / 366 cm #6 waży ok. 215 gr  dobrze rzuca z głowicą lub linką 15 g/230 gr... ECHO BOOST BEACH 12'1" / 369 cm #7 waży ok. 215 gr dobrze rzuca z głowicą lub linką 18 g/265 gr... ECHO BOOST BEACH 12'2" / 372 cm #8 waży ok. 215 gr  dobrze rzuca z głowicą lub linką 20 g/300 gr... ECHO BOOST BEACH 12'2" / 372 cm #9 waży ok. 215 gr dobrze rzuca z głowicą lub linką 22g/330gr... ;1650.00 ;;;1;1;1;1;0;0;0;0;
160;Wędka muchowa Echo One Hand Spey;https://flyhouse.pl/pl/wedki-muchowe-echo-dwureczne/wedka-muchowa-echo-one-hand-spey.html#/50-klasa-6/74-akcja-med_fast/79-czesci-4/614-modele_wedek_echo_th-6104/626-dlugosc-10_4_315cm;14;https://flyhouse.pl/3783-large_default/wedka-muchowa-echo-one-hand-spey.jpg,https://flyhouse.pl/3782-large_default/wedka-muchowa-echo-one-hand-spey.jpg,;Połączenie między rzucaniem jedną ręką i dwiema rękami. PRAWDZIWA „wędzisko typu switch”. Wędka, która może być skutecznie używana zarówno  do dodawania podwójnego pociągnięcia do rzutu spey jedną ręką,  aby wystrzelić głowicę skagit w ciasnych miejscach, jak i do rzutu nad głową. Ekstremalnie lekkie wędziska z mocą głębokiego ładowania. Dzięki zastosowaniu grafitu o wysokim module udało nam się uzyskać niezwykle lekką wędzisko,  nie tracąc jednocześnie zdolności do głębokiego ładowania do dolnych sekcji podczas wykonywania rzutów spey. Niezrównana wszechstronność. Niezależnie od tego, czy rzucasz spey krótkim Skagitem z tonącą końcówką, wykonujesz bombery na spławiku,  czy wykonujesz skuteczne naprawy na duże odległości z ulubionym zestawem nimfowym, wędzisko OHS jest dostrojone. Konstrukcja czteroczęściowa Blank: Gloss szmaragdowo zielony Akcja: Med Fast+ Tuba: pokrowiec na wędkę i skarpeta pokryte materiałem Przelotki: przelotki SIC Stripping i przelotki Snake Hard Chrome Uchwyty: Posiada zdejmowany uchwyt dolnika Uchwyt kołowrotka: Anodowane aluminium ECHO OHS 10'4" / 317 cm #6 One Hand Spey, waga ok. 130 g. ECHO OHS 10'4" / 317 cm #7 One Hand Spey, waga ok. 136 g ECHO OHS 10'4" / 317 cm #8 One Hand Spey, waga ok. 142 g ;2595.00 ;;;1;1;1;1;0;0;0;0;
161;Wędka muchowa Traper GST;https://flyhouse.pl/pl/wedki-muchowe-traper/wedka-muchowa-traper-gst.html#/6-klasa-1/62-dlugosc-9_6_290cm/74-akcja-med_fast/79-czesci-4/1059-uchwyt_kolowrotka-a/1088-modele_wedek_traper-961_4;15;https://flyhouse.pl/3705-large_default/wedka-muchowa-traper-gst.jpg,https://flyhouse.pl/3706-large_default/wedka-muchowa-traper-gst.jpg,;Wędki zawodnicze zaprojektowane przez Mistrzów Świata i Europu - Kadrę Narodową.  Wysokomodułowy japoński blank Carboflex 430 został pokryty matową powłoką lakieru. Nie powoduje to odbicia światła, które płoszy ryby.  Idealny rozstaw i wielkość przelotek TITANIUM TM sprawia, ze akcja jest równomierna i niezwykle szybka.  Płynne, harmonijne ugięcie sprawia, ze holowanie ryby jest pewne i bezpieczne bez ryzyka jej utraty.  W wędzisku zastosowano rękojeść z portugalskiego korka AAAA zakończonego trwałą mieszanką korka z gumą.  Uchwyt do kołowrotka jest z wytrzymałego aluminium wykonanego w technologii CNC. Podstawą uchwytu jest mocna, ultralekka tuleja z włókna węglowego.  W konsekwencji właściwego i przemyślanego doboru wszystkich elementów tej konstrukcji mamy do czynienia z perfekcyjną wędką,  która zadowoli najbardziej wytrawnych "graczy".  W zestawie znajduje się dzielona cordurowa tuba i miękki pokrowiec służący do transportu w tubach zbiorczych.  Wędka jest objęta 25-letnią gwarancją serwisową. ;1680.00 ;;;1;1;1;1;0;0;0;0;
162;Wędka muchowa Traper  SILENCE DH Spey;https://flyhouse.pl/pl/strona-glowna/wedka-muchowa-traper-silence-dh-spey-.html#/18-akcja-fast/51-klasa-7/66-dlugosc-13_396cm/81-czesci-6;15;https://flyhouse.pl/3688-large_default/wedka-muchowa-traper-silence-dh-spey-.jpg,https://flyhouse.pl/3694-large_default/wedka-muchowa-traper-silence-dh-spey-.jpg,;Zaprojektowane i stworzone od podstaw przez wybitnego znawcę wędek dwuręcznych, Piotra Talmę – Master Instruktora, Silence Spey DH,  występują w dwóch wersjach : 13'0”#7, która sprawdzi się na mniejszych rzekach lub podczas niżówki, 14'0”#9 na duże rzeki.  Wędziska zostały skonstruowane tak, aby z łatwością obsługiwać zarówno głowice Skagit, jak i Scandi.  Konstrukcja japońskiego blanku Carboflex 460 zwiększa moc i doskonale tłumi drgania,  co zdecydowanie zmniejsza wysiłek podczas wykonywania długich rzutów i podnosi jakość prezentacji.  Sześcioskładowa konstrukcja pozwoli Ci podróżować na swoje wymarzone łowiska łososi, troci czy stealheadów bez dodatkowych opłat lotniczych.  Wykończone z dbałością o szczegóły.  Najwyższej klasy portugalski korek, przelotki Pacific Bay, mocny, aluminiowy uchwyt kołowrotka, wykonany w technologii CNC.  W komplecie tuba kordurowa i pokrowiec z miękkiej siatki.  Wędzisko jest objęte 25-letnią gwarancją serwisową. ;2569.00 ;;;1;1;1;1;0;0;0;0;
163;Wędka muchowa Traper Silence Ocean;https://flyhouse.pl/pl/wedki-muchowe-traper/wedka-muchowa-traper-silence-ocean-.html#/18-akcja-fast/51-klasa-7/60-dlugosc-9_274cm/79-czesci-4/1482-modele_wedek_traper-907_4;15;https://flyhouse.pl/3695-large_default/wedka-muchowa-traper-silence-ocean-.jpg,https://flyhouse.pl/3696-large_default/wedka-muchowa-traper-silence-ocean-.jpg,;Po ogromnym sukcesie wędek Silence SW przyszedł czas, aby podnieść poprzeczkę.  Przygotowaliśmy coś specjalnego dla wszystkich tych, którzy chcą zmierzyć się z mieszkańcami mórz i oceanów. Od Kostaryki, przez Florydę po Malediwy.  Od płochliwych Bonefishy, przez potężne Tarpony po siejące postrach na flatsach GT. Projektując serię Silence Ocean — mieliśmy jeden cel.  Stworzyć wędkę, która wyznaczy zupełnie nowy standard w tej półce cenowej.  Wędkę, której możecie zaufać. Sercem nowej serii są japońskie nieszlifowane blanki Carboflex 460.  Uzbroiliśmy je w lekkie tytanowe przelotki, portugalski korek klasy AAAAA wzmocniony w newralgicznych miejscach wstawkami  z korkogumy oraz wykonany w technologii CNC zaprojektowany przez nas uchwyt kołowrotka.  W komplecie ochronna aluminiowa tuba oraz pokrowiec z miękkiej siatki.  Wędzisko jest objęte 25-letnią gwarancją serwisową ;2285.00 ;;;1;1;1;1;0;0;0;0;
164;Wędka muchowa Traper Warrior DH Spey;https://flyhouse.pl/pl/wedki-muchowe-traper/wedka-muchowa-traper-warrior-dh-spey.html#/51-klasa-7/66-dlugosc-13_396cm/74-akcja-med_fast/81-czesci-6;15;https://flyhouse.pl/3717-large_default/wedka-muchowa-traper-warrior-dh-spey.jpg,https://flyhouse.pl/3718-large_default/wedka-muchowa-traper-warrior-dh-spey.jpg,;Konstrukcja wędziska Warrior Spey jest oparta na sprawdzonym blanku 40T. Gwarantuje to, że wędka sprosta wszystkim wyzwaniom.  Dwuręczne wędziska tej długości muszą przyjąć i wytrzymać znacznie większe obciążenia od wędek jednoręcznych.  Rękojeść wykonana jest z korka AAA, który dla wzmocnienia wykończony został, korkogumą.  Solidny, odwrócony uchwyt do kołowrotka posiada docisk w postaci dwóch nakrętek.  Amerykańskie przelotki Pacyfic Bay stanowią uzbrojenie wędki.  Wędka składa się z sześciu elementów, zapewnia to wygodny transport i umożliwia zabranie wędki w podróż lotniczą,  bez dodatkowych opłat. W komplecie tuba z cordury. Wędka posiada pięcioletnią gwarancję serwisową ;1074.00 ;;;1;1;1;1;0;0;0;0;
165;Wędka muchowa Traper Silence;https://flyhouse.pl/pl/wedki-muchowe-traper/wedka-muchowa-traper-silence-.html#/6-klasa-1/18-akcja-fast/61-dlugosc-10_305cm/79-czesci-4;15;https://flyhouse.pl/3729-large_default/wedka-muchowa-traper-silence-.jpg,https://flyhouse.pl/3730-large_default/wedka-muchowa-traper-silence-.jpg,;Wychodząc naprzeciw muszkarzom, którzy mają najwyższe wymagania firma Traper wykonała perfekcyjne i niezawodne wędki SILENCE.  Wyprodukowano je z użyciem najnowocześniejszych obecnie technologii.  Japońskie blanki węglowe CARBOFLEX 460, uzbrojone w lekkie przelotki TITANIUM, portugalski korek AAAAA oraz nowoczesny ultralekki,  a jednocześnie wytrzymały uchwyt kołowrotka. Doskonale wyważone, o równomiernym, harmonijnym ugięciu i szybkiej akcji robią ogromne wrażenie.  W dość szerokiej serii można znaleźć wędki od delikatnych dwójek aż po streamerowe siódemki.  Wszystkie wyposażone w solidne tuby i oddychające pokrowce.  Wędki serii SILENCE są objęte 25 letnią gwarancją dla pierwszego właściciela. ;1958.00 ;;;1;1;1;1;0;0;0;0;
166;Wędka muchowa Winston AIR 2;https://flyhouse.pl/pl/wedki-muchowe-rl-winston/wedka-muchowa-winston-air-2.html#/8-klasa-3/18-akcja-fast/59-dlugosc-8_6_259cm/79-czesci-4/750-modele_wedek_rlwinston-863_4;16;https://flyhouse.pl/1088-large_default/wedka-muchowa-winston-air-2.jpg,https://flyhouse.pl/1087-large_default/wedka-muchowa-winston-air-2.jpg,;Winston AIR 2 ;5475.00 ;;;1;1;1;1;0;0;0;0;
167;Wędka muchowa Winston Pure 2;https://flyhouse.pl/pl/wedki-muchowe-rl-winston/wedka-muchowa-winston-pure-2.html#/7-klasa-2/70-dlugosc-7_0_213cm/79-czesci-4/756-modele_wedek_rlwinston-702_4/808-akcja-medium;16;https://flyhouse.pl/1089-large_default/wedka-muchowa-winston-pure-2.jpg,https://flyhouse.pl/1090-large_default/wedka-muchowa-winston-pure-2.jpg,;Winston Pure ;4475.00 ;;;1;1;1;1;0;0;0;0;
168;Wędka muchowa Winston Saltwater Air;https://flyhouse.pl/pl/wedki-muchowe-rl-winston/-winston-saltwater-air.html#/18-akcja-fast/52-klasa-8/60-dlugosc-9_274cm/79-czesci-4/768-modele_wedek_rlwinston-908_4;16;https://flyhouse.pl/1093-large_default/-winston-saltwater-air.jpg,https://flyhouse.pl/1094-large_default/-winston-saltwater-air.jpg,;Winston Saltwater Air ;4975.00 ;;;1;1;1;1;0;0;0;0;
169;Wędka muchowa Winston Air TH;https://flyhouse.pl/pl/wedki-muchowe-rl-winston/-winston-air-th.html#/49-klasa-5/65-dlugosc-12_366cm/74-akcja-med_fast/79-czesci-4/773-modele_wedek_rlwinston-1205_4;16;https://flyhouse.pl/1096-large_default/-winston-air-th.jpg,https://flyhouse.pl/1097-large_default/-winston-air-th.jpg,;Winston Air TH ;6475.00 ;;;1;1;1;1;0;0;0;0;
170;Wędka muchowa Winston Boron MicroSpey;https://flyhouse.pl/pl/wedki-muchowe-rl-winston/-winston-boron-microspey.html#/8-klasa-3/18-akcja-fast/58-dlugosc-10_6_320cm/79-czesci-4/784-modele_wedek_rlwinston-1063_4;16;https://flyhouse.pl/1105-large_default/-winston-boron-microspey.jpg,https://flyhouse.pl/1104-large_default/-winston-boron-microspey.jpg,;Winston Boron MicroSpey ;5495.00 ;;;1;1;1;1;0;0;0;0;
171;Wędka muchowa Winston Bamboo;https://flyhouse.pl/pl/wedki-muchowe-rl-winston/-winston-bamboo.html#/8-klasa-3/78-czesci-3/787-modele_wedek_rlwinston-603_3/810-dlugosc-6_0_183cm;16;https://flyhouse.pl/1108-large_default/-winston-bamboo.jpg,https://flyhouse.pl/1109-large_default/-winston-bamboo.jpg,;Winston Bamboo ;17500.00 ;;;1;1;1;1;0;0;0;0;
172;Winston Boron Super 10;https://flyhouse.pl/pl/wedki-muchowe-rl-winston/winston-boron-super-10.html#/8-klasa-3/61-dlugosc-10_305cm/79-czesci-4/760-modele_wedek_rlwinston-1003_4/808-akcja-medium;16;https://flyhouse.pl/3564-large_default/winston-boron-super-10.jpg,https://flyhouse.pl/3562-large_default/winston-boron-super-10.jpg,;Winston Boron Super 10 ;4375.00 ;;;1;1;1;1;0;0;0;0;
173;Wędka muchowa Boron III TH;https://flyhouse.pl/pl/wedki-muchowe-rl-winston/-boron-iii-th.html#/51-klasa-7/79-czesci-4/745-dlugosc-12_9_389cm/1467-modele_wedek_rlwinston-1297_4;16;https://flyhouse.pl/3565-large_default/-boron-iii-th.jpg,https://flyhouse.pl/3566-large_default/-boron-iii-th.jpg,;;3600.00 ;;;1;1;1;1;0;0;0;0;
