608;Wodery do brodzenia Orvis PRO;https://flyhouse.pl/pl/wodery-orvis/wodery-do-brodzenia-orvis-pro.html#/250-rozmiar_spodniobutow-medium_short/259-rozmiar_buta-8_10;55;https://flyhouse.pl/468-large_default/wodery-do-brodzenia-orvis-pro.jpg,https://flyhouse.pl/460-large_default/wodery-do-brodzenia-orvis-pro.jpg,;Orvis PRO Wader został stworzony dla profesjonalnego wędkarza, który dołoży wszelkich starań, aby znaleźć ryby. Zbudowany z atletycznym krojem, PRO Wader wykorzystuje wyjątkowo trwałą, 4-warstwową powłokę z tkaniny Cordura® w górnej części i 5-warstwową powłokę z tkaniny Cordura w dolnej części nogawek, aby zapewnić najlepszą w swojej klasie odporność na ścieranie i przebicie. Niskoprofilowa konstrukcja szwu i klin z krokiem zwiększają ruch i wytrzymałość krocza. Nowoczesne anatomicznie poprawione ochraniacze neoprenowe mają mniejszą masę i są wygodniejsze w butach do brodzenia, a opływowa, wzmocniona PU siatkowa osłona żwiru ściśle przylega do buta i całkowicie eliminuje opór i gromadzenie wody. Wygodna zewnętrzną kieszeń z wodoodpornym zamkiem błyskawicznym YKK AquaGuard®, który utrzymuje niezbędne rzeczy suche i zapobiega utracie. Gumowane zakładki na szelkach i łańcuch na przedniej kieszeni do narzędzi, oferują wiele lokalizacji niezbędnych rzeczy i eliminują ryzyko przebicia woderów lub utraty narzędzi. Naszywana naszywka na przedniej kieszeni zapewnia szybkie zmiany i suszenie much. Duża czterokierunkowa wewnętrzna kieszeń z elastycznej siatki powiększa się, aby zmieścić większe przedmioty, ale nie przeszkadza, gdy jest pusta. Kieszenie polarowe z podszewką z polaru z wodoodpornymi zamkami YKK AquaGuard. Wyjmowane ochraniacze kolan OrthoLite® wykorzystują tę samą technologię, która znajduje się w naszej wkładce PRO Boot, zapewniając optymalny komfort i odbicie. Wyjmowana kieszeń na akcesoria pozwala na szybki dostęp do sprzętu i oferuje cechy małej paczki. Regulowane elastyczne szelki z przeciwstawnymi klamrami do konwersji talii. Wewnętrzna naszywka na rzep mieści naszą wodoodporną kieszeń Orvis (8G3H sprzedawana osobno). Wadery ważą około 48 uncji w (średnim rozmiarze).100% nylonowa powłoka z membraną poliuretanową. Podszewka trykot 100% nylon. Importowany. 14 rozmiarów S-XXL, w tym krótkie i długie rozmiary.;3100.00;;;1;1;1;1;10;0;0;0;
609;Wodery do brodzenia Orvis Pro Light;https://flyhouse.pl/pl/wodery-orvis/wodery-do-brodzenia-orvis-pro-light.html#/244-rozmiar_spodniobutow-small/258-rozmiar_buta-7_9;55;https://flyhouse.pl/3601-large_default/wodery-do-brodzenia-orvis-pro-light.jpg,https://flyhouse.pl/3602-large_default/wodery-do-brodzenia-orvis-pro-light.jpg,;Tak firma Orvis opisuje model woderów ORVIS PRO LT: Nasz najbardziej wytrzymały, a jednocześnie lekki system spodniobutów. Opatentowana czterowarstwowa powłoka z tkaniny CORDURA®. Łatwe, niekrępujące ruchy dzięki klinowi w kroku i niskoprofilowej konstrukcji szwów. Wygodna, elastyczna i pojemna zewnętrzna kieszeń do ogrzewania dłoni i przechowywania akcesoriów. Szybki dostęp do narzędzi dzięki gumowym uchwytom kieszeni i łańcuszkowi daisy. Profilowany komfort stóp dzięki nowoczesnym, anatomicznie zaprojektowanym skarpetą z neoprenu. Eliminujące opór, opływowe, wzmocnione poliuretanem ochraniacze przeciw żwirowi z ukrytym zatrzaskiem, aby utrzymać je przymocowane do buta podczas brodzenia. Wyściełane, wygodne, wyjmowane, przeprojektowane nakolanniki OrthoLite o grubości 3 mm. Wodery idealnie pasują do butów do brodzenia ORVIS PRO LT.;2500.00;;;1;1;1;1;10;0;0;0;
610;Wodery do brodzenia Orvis PRO Light Wading Pants krótkie do pasa;https://flyhouse.pl/pl/wodery-orvis/wodery-do-brodzenia-orvis-pro-light-wading-pants-krotkie-do-pasa.html#/250-rozmiar_spodniobutow-medium_short/259-rozmiar_buta-8_10;55;https://flyhouse.pl/3604-large_default/wodery-do-brodzenia-orvis-pro-light-wading-pants-krotkie-do-pasa.jpg,https://flyhouse.pl/3605-large_default/wodery-do-brodzenia-orvis-pro-light-wading-pants-krotkie-do-pasa.jpg,;Opatentowana czterowarstwowa powłoka z tkaniny CORDURA® zapewniająca maksymalną trwałość. Wodoodporny zamek błyskawiczny TIZIP® MasterSeal ułatwiający zakładanie i zdejmowanie. Wyjmowane nakolanniki OrthoLite® o grubości 3 mm. Nowoczesne, anatomicznie poprawne, neoprenowe buty. Klin w kroku i niskoprofilowa konstrukcja szwów. Łańcuchowe mocowanie akcesoriów. Zewnętrzna kieszeń do przechowywania. Ukryty zatrzask buta, aby utrzymać osłonę przeciwżwirową na dole. Uproszczona osłona przeciwżwirowa z siatki wzmocnionej poliuretanem eliminuje opór i zbieranie się wody.;1950.00;;;1;1;1;1;10;0;0;0;
611;Wodery do brodzenia Orvis Ultralight Convertible;https://flyhouse.pl/pl/wodery-orvis/wodery-do-brodzenia-orvis-ultralight-convertible.html#/244-rozmiar_spodniobutow-small/258-rozmiar_buta-7_9;55;https://flyhouse.pl/476-large_default/wodery-do-brodzenia-orvis-ultralight-convertible.jpg,https://flyhouse.pl/470-large_default/wodery-do-brodzenia-orvis-ultralight-convertible.jpg,;Wodery męskie Orvis Ultralight, to kolejny element całego systemu Ultralihght. Są one niezwykle wsyechstronnym projektem,lekkich woderów które nic nie tracą na wytrzymałości i właściwościach w porównaniu do klasycznych "grubych" woderów.. Niesamowicie wygodne, nowocześnie dopasowane, zapewnia doskonałą wydajność bez wsrostu wagi i masy. Powłoka zewnętrzna: 100% nylon. Membrana: dwuskładnikowy poliuretan. Wkładka: 100% trykot nylonowy. Importowany.  - Nowoczesny krój - 4-warstwowa, wodoodporna, oddychająca tkanina nylonowa - Zapięcia magnetyczne FIDLOCK SNAP zapewniają szybką i lekką konwersję w pasie - Kieszeń zewnętrzna z wodoodpornym suwakiem YKK AquaGuard® - Zintegrowana stacja dokująca - Ergonomiczne skarpety z neoprenu o wysokiej gęstości - Zintegrowane ochraniacze, zapobiegają przedostawaniu się żwiru i piasku do butów i jednocześnie zmniejszają opór wody. - Nowa nisko profilowana konstrukcja szwów ze strategicznym wzmocnieniem w obszarach o dużym obciążeniu - Wewnętrzna kieszeń na zamek błyskawiczny z czterostronnie rozciągliwą siatką - Niskoprofilowe szlufki z paskiem 1,5 "w komplecie - Rzep na wewnętrznej kieszeni na wodoszczelną kieszeń Orvis (8G3H sprzedawana oddzielnie) Przybliżona waga rozmiar L 35 uncji / 995 g;1950.00;;;1;1;1;1;10;0;0;0;
612;Wodery do brodzenia Orvis Clearwater Wader;https://flyhouse.pl/pl/wodery-orvis/wodery-do-brodzenia-orvis-clearwater-wader.html#/246-rozmiar_spodniobutow-medium_long/261-rozmiar_buta-10_12;55;https://flyhouse.pl/484-large_default/wodery-do-brodzenia-orvis-clearwater-wader.jpg,https://flyhouse.pl/478-large_default/wodery-do-brodzenia-orvis-clearwater-wader.jpg,;Orvis Clearwater Wader;1260.00;;;1;1;1;1;10;0;0;0;
613;G4Z Stockingfoot;https://flyhouse.pl/pl/wodery-simms/g4z-stockingfoot.html#/244-rozmiar_spodniobutow-small/819-rozmiar_buta-7_8;56;https://flyhouse.pl/1110-large_default/g4z-stockingfoot.jpg,https://flyhouse.pl/1111-large_default/g4z-stockingfoot.jpg,;Trzy warstwowa górna warstwa GORE-TEX® Pro Shell.;5845.00;;;1;1;1;1;10;0;0;0;
614;G4 Pro Stockingfoot;https://flyhouse.pl/pl/wodery-simms/g4-pro-stockingfoot.html#/244-rozmiar_spodniobutow-small/819-rozmiar_buta-7_8;56;https://flyhouse.pl/1113-large_default/g4-pro-stockingfoot.jpg,https://flyhouse.pl/1114-large_default/g4-pro-stockingfoot.jpg,;;4695.00;;;1;1;1;1;10;0;0;0;
615;Mens Swiftcurrent Expedition Waders;https://flyhouse.pl/pl/wodery-patagonia/men-s-swiftcurrent-expedition-waders.html#/1236-rozmiar_spodniobutow-small_short/1238-rozmiar_buta-55_75;57;https://flyhouse.pl/2428-large_default/men-s-swiftcurrent-expedition-waders.jpg,https://flyhouse.pl/2429-large_default/men-s-swiftcurrent-expedition-waders.jpg,;Men's Swiftcurrent Expedition Waders;2950.00;;;1;1;1;1;10;0;0;0;
616;Mens Swiftcurrent Expedition Zip-Front Waders;https://flyhouse.pl/pl/wodery-patagonia/men-s-swiftcurrent-expedition-zip-front-waders.html#/1236-rozmiar_spodniobutow-small_short/1238-rozmiar_buta-55_75;57;https://flyhouse.pl/2437-large_default/men-s-swiftcurrent-expedition-zip-front-waders.jpg,https://flyhouse.pl/2436-large_default/men-s-swiftcurrent-expedition-zip-front-waders.jpg,;Men's Swiftcurrent Expedition Zip-Front Waders;3380.00;;;1;1;1;1;10;0;0;0;
617;Mens Swiftcurrent Wading Pants;https://flyhouse.pl/pl/wodery-patagonia/men-s-swiftcurrent-wading-pants.html#/244-rozmiar_spodniobutow-small/1239-rozmiar_buta-85_105;57;https://flyhouse.pl/2445-large_default/men-s-swiftcurrent-wading-pants.jpg,https://flyhouse.pl/2446-large_default/men-s-swiftcurrent-wading-pants.jpg,;Men's Swiftcurrent Wading Pants;1800.00;;;1;1;1;1;10;0;0;0;
618;Buty do brodzenia Orvis PRO BOA;https://flyhouse.pl/pl/buty-do-brodzenia-meskie/buty-do-brodzenia-orvis-pro-boa.html#/271-rozmiar_buta-7;60;https://flyhouse.pl/496-large_default/buty-do-brodzenia-orvis-pro-boa.jpg,https://flyhouse.pl/494-large_default/buty-do-brodzenia-orvis-pro-boa.jpg,;Orvis ma zaszczyt zaprezentować pierwszy w historii produkt powstały dzięki wysiłkowi dwóch firm z olbrzymią tradycją w swojej dziedzinie. Współpraca Orvisa z firmą Michelin zaowocowała powstaniem podeszwy o najlepszej trakcji podczas brodzenia w wodzie, oraz odlewanej zewnętrznej części buta, która eliminuje szwy w strefach zwiększonego tarcia, zapewniając jednocześnie niedoścignioną trwałość i wytrzymałość butów.;1495.00;;;1;1;1;1;10;0;0;0;
619;Buty do brodzenia Orvis PRO Wading;https://flyhouse.pl/pl/buty-do-brodzenia-meskie/buty-do-brodzenia-orvis-pro-wading.html#/271-rozmiar_buta-7;60;https://flyhouse.pl/505-large_default/buty-do-brodzenia-orvis-pro-wading.jpg,https://flyhouse.pl/497-large_default/buty-do-brodzenia-orvis-pro-wading.jpg,;Orvis ma zaszczyt zaprezentować pierwszy w historii produkt powstały dzięki wysiłkowi dwóch firm z olbrzymią tradycją w swojej dziedzinie. Współpraca Orvisa z firmą Michelin zaowocowała powstaniem podeszwy o najlepszej trakcji podczas brodzenia w wodzie, oraz odlewanej zewnętrznej części buta, która eliminuje szwy w strefach zwiększonego tarcia, zapewniając jednocześnie niedoścignioną trwałość i wytrzymałość butów.;1395.00;;;1;1;1;1;10;0;0;0;
620;Buty do brodzenia Orvis Ultralight Wading;https://flyhouse.pl/pl/buty-do-brodzenia-meskie/-orvis-ultralight-wading.html#/271-rozmiar_buta-7;60;https://flyhouse.pl/509-large_default/-orvis-ultralight-wading.jpg,https://flyhouse.pl/506-large_default/-orvis-ultralight-wading.jpg,;Buty Orvis Ultralight Wading;945.00;;;1;1;1;1;10;0;0;0;
621;Buty do brodzenia Orvis PRO Approach;https://flyhouse.pl/pl/buty-do-brodzenia-morskie/-orvis-pro-approach.html#/271-rozmiar_buta-7/274-kolor_butow-szary;60;https://flyhouse.pl/518-large_default/-orvis-pro-approach.jpg,https://flyhouse.pl/517-large_default/-orvis-pro-approach.jpg,;Buty Orvis PRO Approach;745.00;;;1;1;1;1;10;0;0;0;
622;Buty do brodzenia Orvis Encounter Wading - na filcu;https://flyhouse.pl/pl/buty-do-brodzenia-meskie/buty-do-brodzenia-orvis-encounter-wading-na-filcu.html#/266-rozmiar_buta-10;60;https://flyhouse.pl/521-large_default/buty-do-brodzenia-orvis-encounter-wading-na-filcu.jpg,https://flyhouse.pl/522-large_default/buty-do-brodzenia-orvis-encounter-wading-na-filcu.jpg,;Buty z podeszwą filcową Orvis Encounter Wading - Felt;450.00;;;1;1;1;1;10;0;0;0;
623;Buty do brodzenia Orvis Clearwater Wading Felt;https://flyhouse.pl/pl/buty-do-brodzenia-meskie/-orvis-clearwater-wading-felt.html#/271-rozmiar_buta-7;60;https://flyhouse.pl/527-large_default/-orvis-clearwater-wading-felt.jpg,https://flyhouse.pl/525-large_default/-orvis-clearwater-wading-felt.jpg,;Buty do brodzenia Orvis Clearwater Wading Felt;895.00;;;1;1;1;1;10;0;0;0;
624;Buty do brodzenia Orvis Clearwater Wading Rubber Sole;https://flyhouse.pl/pl/strona-glowna/-orvis-clearwater-wading-rubber-sole.html#/271-rozmiar_buta-7;60;https://flyhouse.pl/532-large_default/-orvis-clearwater-wading-rubber-sole.jpg,https://flyhouse.pl/528-large_default/-orvis-clearwater-wading-rubber-sole.jpg,;Buty do brodzenia z podeszwą gumową Orvis Clearwater Wading Rubber Sole;895.00;;;1;1;1;1;10;0;0;0;
625;Buty do brodzenia Simms Freestone Boot;https://flyhouse.pl/pl/buty-do-brodzenia-meskie/buty-do-brodzenia-simms-freestone-boot.html#/271-rozmiar_buta-7;60;https://flyhouse.pl/1198-large_default/buty-do-brodzenia-simms-freestone-boot.jpg,;Freestone Boot;1120.00;;;1;1;1;1;10;0;0;0;
626;Buty do brodzenia Patagonia Foot Tractor Wading Boots - Sticky Rubber;https://flyhouse.pl/pl/buty-do-brodzenia-meskie/buty-do-brodzenia-patagonia-foot-tractor-wading-boots-sticky-rubber.html#/272-rozmiar_buta-5;60;https://flyhouse.pl/2450-large_default/buty-do-brodzenia-patagonia-foot-tractor-wading-boots-sticky-rubber.jpg,https://flyhouse.pl/2451-large_default/buty-do-brodzenia-patagonia-foot-tractor-wading-boots-sticky-rubber.jpg,;Foot Tractor Wading Boots - Sticky Rubber;1800.00;;;1;1;1;1;10;0;0;0;
627;Buty do brodzenia Patagonia Foot Tractor Wading Boots - Aluminum Bar;https://flyhouse.pl/pl/buty-do-brodzenia-meskie/buty-do-brodzenia-patagonia-foot-tractor-wading-boots-aluminum-bar.html#/272-rozmiar_buta-5;60;https://flyhouse.pl/2458-large_default/buty-do-brodzenia-patagonia-foot-tractor-wading-boots-aluminum-bar.jpg,https://flyhouse.pl/2459-large_default/buty-do-brodzenia-patagonia-foot-tractor-wading-boots-aluminum-bar.jpg,;Foot Tractor Wading Boots - Aluminum Bar;2120.00;;;1;1;1;1;10;0;0;0;
628;Buty do brodzenia Orvis PRO LT Wading Boots;https://flyhouse.pl/pl/strona-glowna/buty-do-brodzenia-orvis-pro-lt-wading-boots.html#/266-rozmiar_buta-10/274-kolor_butow-szary;60;https://flyhouse.pl/3660-large_default/buty-do-brodzenia-orvis-pro-lt-wading-boots.jpg,https://flyhouse.pl/3661-large_default/buty-do-brodzenia-orvis-pro-lt-wading-boots.jpg,;Buty do brodzenia Orvis PRO LT. Nasze buty do brodzenia PRO LT charakteryzują się lekką konstrukcją i wieloma wydajnymi technologiami. Zainspirowane oryginałem, nasze nowe buty do brodzenia PRO LT są prawie o 10% lżejsze w jeszcze bardziej zwinnej platformie, która zachowuje znaczną trwałość. Podeszwa zewnętrzna jest wykonana z tej samej najlepszej w swojej klasie przyczepności mokrej gumy Michelin®, co Outdoor Extreme. Wkładka z pianki Intuition® zapewnia pożądaną amortyzację wstrząsów i wsparcie, formując się wokół stopy z czasem, aby uzyskać niemal niestandardowe dopasowanie bez płacenia dodatkowych opłat za niestandardowe wkładki. Średniej wysokości kołnierz utrzymuje stabilność kostki, a mniejsza waga zwiększa zwinność i prędkość wędkarza podczas pokonywania kilometrów. To samo dotyczy bezpiecznego oparcia zapewnianego przez unikalne, jednoczęściowe, wyściełane owinięcie 360° przypominające but narciarski: chodzi o bezpieczne oparcie przy jednoczesnym oszczędzaniu wagi. Odporny na ścieranie PU-cast Kurim® Mudguard zapewnia dodatkową trwałość i ochronę stóp, z systemem sznurowania Speed ​​Lace o niższym profilu, który umożliwia szybkie sznurowanie i idealne napięcie — nawet w lekkich rękawiczkach. Idealnie pasuje do spodniobutów PRO LT Waders. Prawie 10% lżejsze od oryginalnych butów do brodzenia PRO, a mimo to bezkompromisowo wytrzymałe. Podeszwa zewnętrzna z gumy Michelin Outdoor Extreme. Ultrawspierająca, amortyzująca wkładka wykonana z pianki Intuition®. Zwiększona zwinność bez utraty wsparcia kostki dzięki średniej wysokości cholewki Bezpieczniejsze trzymanie stopy dzięki jednoczęściowemu, 360-stopniowemu, wyściełanemu owinięciu w stylu buta narciarskiego. Wytrzymały, odporny na ścieranie błotnik Kurim®. Szybki, bezpieczny, jeszcze bardziej niskoprofilowy system sznurowania Idealnie pasuje do woderów PRO LT.;1350.00;;;1;1;1;1;10;0;0;0;
629;Orvis Christmas Isnald;https://flyhouse.pl/pl/buty-do-brodzenia-morskie/orvis-christmas-isnald.html#/272-rozmiar_buta-5;62;https://flyhouse.pl/511-large_default/orvis-christmas-isnald.jpg,;Buty do brodzenia w morzu Orvis Christmas Isnald;450.00;;;1;1;1;1;10;0;0;0;
630;Buty do brodzenia Orvis PRO Approach;https://flyhouse.pl/pl/buty-do-brodzenia-morskie/-orvis-pro-approach.html#/271-rozmiar_buta-7/274-kolor_butow-szary;62;https://flyhouse.pl/518-large_default/-orvis-pro-approach.jpg,https://flyhouse.pl/517-large_default/-orvis-pro-approach.jpg,;Buty Orvis PRO Approach;745.00;;;1;1;1;1;10;0;0;0;
631;Orvis POSIGRIP kolce;https://flyhouse.pl/pl/akcesoria_do_butow/orvis-posigrip-kolce.html;63;https://flyhouse.pl/520-large_default/orvis-posigrip-kolce.jpg,;Zestaw 24 szt. kolców do butów Orvis;195.00;;;1;1;1;1;10;0;0;0;
632;Replacement Laces;https://flyhouse.pl/pl/akcesoria_do_butow/replacement-laces.html#/370-kolor-pewter;63;https://flyhouse.pl/1211-large_default/replacement-laces.jpg,https://flyhouse.pl/1212-large_default/replacement-laces.jpg,;Replacement Laces;70.00;;;1;1;1;1;10;0;0;0;
633;G4 Pro HardBite™ Star Cleat;https://flyhouse.pl/pl/akcesoria_do_butow/g4-pro-hardbite-star-cleat.html#/829-akcesoria-10_szt;63;https://flyhouse.pl/1214-large_default/g4-pro-hardbite-star-cleat.jpg,;G4 Pro HardBite™ Star Cleat;270.00;;;1;1;1;1;10;0;0;0;
634;G4 Pro AlumiBite™ Cleat;https://flyhouse.pl/pl/akcesoria_do_butow/g4-pro-alumibite-cleat.html#/829-akcesoria-10_szt;63;https://flyhouse.pl/1216-large_default/g4-pro-alumibite-cleat.jpg,https://flyhouse.pl/1217-large_default/g4-pro-alumibite-cleat.jpg,;G4 Pro AlumiBite™ Cleat;160.00;;;1;1;1;1;10;0;0;0;
635;HardBite™ Star Cleat;https://flyhouse.pl/pl/akcesoria_do_butow/hardbite-star-cleat.html#/829-akcesoria-10_szt;63;https://flyhouse.pl/1220-large_default/hardbite-star-cleat.jpg,;HardBite™ Star Cleat;170.00;;;1;1;1;1;10;0;0;0;
636;AlumiBite™ Cleat;https://flyhouse.pl/pl/akcesoria_do_butow/alumibite-cleat.html#/829-akcesoria-10_szt;63;https://flyhouse.pl/1222-large_default/alumibite-cleat.jpg,;AlumiBite™ Cleat;115.00;;;1;1;1;1;10;0;0;0;
637;HardBite™ Boot Stud-Vibram;https://flyhouse.pl/pl/akcesoria_do_butow/hardbite-boot-stud-vibram.html#/831-akcesoria-20_szt;63;https://flyhouse.pl/1224-large_default/hardbite-boot-stud-vibram.jpg,;HardBite™ Boot Stud-Vibram;160.00;;;1;1;1;1;10;0;0;0;
638;HardBite™ Boot Studs-Felt;https://flyhouse.pl/pl/akcesoria_do_butow/hardbite-boot-studs-felt.html#/831-akcesoria-20_szt;63;https://flyhouse.pl/1226-large_default/hardbite-boot-studs-felt.jpg,;HardBite™ Boot Studs-Felt;160.00;;;1;1;1;1;10;0;0;0;
639;M2 Boa Field Repair Kit;https://flyhouse.pl/pl/akcesoria_do_butow/m2-boa-field-repair-kit.html#/833-rozmiar-s_m;63;https://flyhouse.pl/1227-large_default/m2-boa-field-repair-kit.jpg,;M2 Boa Field Repair Kit;100.00;;;1;1;1;1;10;0;0;0;
640;Simms Gravel Guards;https://flyhouse.pl/pl/akcesoria_do_butow/simms-gravel-guards.html;63;https://flyhouse.pl/2322-large_default/simms-gravel-guards.jpg,;Simms Gravel Guards;225.00;;;1;1;1;1;10;0;0;0;
641;Foot Tractor Aluminum Bar Replacement Kit - Danner;https://flyhouse.pl/pl/akcesoria_do_butow/foot-tractor-aluminum-bar-replacement-kit-danner.html#/347-rozmiar-s;63;https://flyhouse.pl/2478-large_default/foot-tractor-aluminum-bar-replacement-kit-danner.jpg,https://flyhouse.pl/2479-large_default/foot-tractor-aluminum-bar-replacement-kit-danner.jpg,;Foot Tractor Aluminum Bar Replacement Kit - Danner S (5-6), M (7-9), L (10-12), XL (13-14);205.00;;;1;1;1;1;10;0;0;0;
642;Kamizelka Pro Vest;https://flyhouse.pl/pl/kamizelki/kamizelka-pro-vest.html#/397-rozmiar_odziezy-m;65;https://flyhouse.pl/742-large_default/kamizelka-pro-vest.jpg,https://flyhouse.pl/741-large_default/kamizelka-pro-vest.jpg,;Kamizelka Pro Vest;995.00;;;1;1;1;1;10;0;0;0;
643;Kamizelka Ultralight Vest;https://flyhouse.pl/pl/kamizelki/kamizelka-ultralight-vest.html#/397-rozmiar_odziezy-m;65;https://flyhouse.pl/744-large_default/kamizelka-ultralight-vest.jpg,https://flyhouse.pl/743-large_default/kamizelka-ultralight-vest.jpg,;Kamizelka Ultralight Vest;745.00;;;1;1;1;1;10;0;0;0;
644;Kamizelka Clearwater Vest;https://flyhouse.pl/pl/kamizelki/kamizelka-clearwater-vest.html#/396-rozmiar_odziezy-s;65;https://flyhouse.pl/746-large_default/kamizelka-clearwater-vest.jpg,https://flyhouse.pl/745-large_default/kamizelka-clearwater-vest.jpg,;;495.00;;;1;1;1;1;10;0;0;0;
645;Ultralight Wading Jacket;https://flyhouse.pl/pl/kurtki/ultralight-wading-jacket.html#/396-rozmiar_odziezy-s/401-kolor_odziezy-alloy;66;https://flyhouse.pl/727-large_default/ultralight-wading-jacket.jpg,https://flyhouse.pl/728-large_default/ultralight-wading-jacket.jpg,;Ultralight Wading Jacket;1245.00;;;1;1;1;1;10;0;0;0;
646;Pro Wading Jacket;https://flyhouse.pl/pl/kurtki/pro-wading-jacket.html#/396-rozmiar_odziezy-s/404-kolor_odziezy-olive_brown;66;https://flyhouse.pl/730-large_default/pro-wading-jacket.jpg,https://flyhouse.pl/738-large_default/pro-wading-jacket.jpg,;Pro Wading Jacket;1745.00;;;1;1;1;1;10;0;0;0;
647;Clearwater Wading Jacket;https://flyhouse.pl/pl/kurtki/clearwater-wading-jacket.html#/396-rozmiar_odziezy-s/406-kolor_odziezy-moss;66;https://flyhouse.pl/739-large_default/clearwater-wading-jacket.jpg,https://flyhouse.pl/740-large_default/clearwater-wading-jacket.jpg,;Clearwater Wading Jacket;990.00;;;1;1;1;1;10;0;0;0;
648;Pro Insulated Jacket;https://flyhouse.pl/pl/kurtki/pro-insulated-jacket.html#/396-rozmiar_odziezy-s/408-kolor_odziezy-ev_blue;66;https://flyhouse.pl/752-large_default/pro-insulated-jacket.jpg,https://flyhouse.pl/753-large_default/pro-insulated-jacket.jpg,;Pro Insulated Jacket;995.00;;;1;1;1;1;10;0;0;0;
649;Pro LT Hoody Softshell;https://flyhouse.pl/pl/kurtki/pro-lt-hoody-softshell.html#/396-rozmiar_odziezy-s;66;https://flyhouse.pl/755-large_default/pro-lt-hoody-softshell.jpg,https://flyhouse.pl/754-large_default/pro-lt-hoody-softshell.jpg,;Pro LT Hoody Softshell;745.00;;;1;1;1;1;10;0;0;0;
650;Pro Insulated Hoody;https://flyhouse.pl/pl/kurtki/pro-insulated-hoody.html#/396-rozmiar_odziezy-s/408-kolor_odziezy-ev_blue;66;https://flyhouse.pl/756-large_default/pro-insulated-hoody.jpg,https://flyhouse.pl/757-large_default/pro-insulated-hoody.jpg,;Pro Insulated Hoody;1145.00;;;1;1;1;1;10;0;0;0;
651;Ultralight Storm 2,5L Rain Jacket;https://flyhouse.pl/pl/kurtki/ultralight-storm-25l-rain-jacket.html#/396-rozmiar_odziezy-s/500-kolor_odziezy-burnt_henna;66;https://flyhouse.pl/907-large_default/ultralight-storm-25l-rain-jacket.jpg,https://flyhouse.pl/908-large_default/ultralight-storm-25l-rain-jacket.jpg,;Ultralight Storm 2,5L Rain Jacket;845.00;;;1;1;1;1;10;0;0;0;
652;Mens Nano Puff® Hoody;https://flyhouse.pl/pl/kurtki/men-s-nano-puff-hoody.html#/347-rozmiar-s/1253-kolor_odziezy-barn_red;66;https://flyhouse.pl/2527-large_default/men-s-nano-puff-hoody.jpg,https://flyhouse.pl/2528-large_default/men-s-nano-puff-hoody.jpg,;Men's Nano Puff® Hoody;1035.00;;;1;1;1;1;10;0;0;0;
653;Mens Nano Puff® Jacket;https://flyhouse.pl/pl/kurtki/men-s-nano-puff-jacket.html#/347-rozmiar-s/1254-kolor_odziezy-crater_blue;66;https://flyhouse.pl/2537-large_default/men-s-nano-puff-jacket.jpg,https://flyhouse.pl/2538-large_default/men-s-nano-puff-jacket.jpg,;Men's Nano Puff® Jacket;950.00;;;1;1;1;1;10;0;0;0;
654;Mens Micro Puff® Jacket;https://flyhouse.pl/pl/kurtki/men-s-micro-puff-jacket.html#/347-rozmiar-s/1252-kolor_odziezy-forge_grey;66;https://flyhouse.pl/2543-large_default/men-s-micro-puff-jacket.jpg,https://flyhouse.pl/2544-large_default/men-s-micro-puff-jacket.jpg,;Men's Micro Puff® Jacket;990.00;;;1;1;1;1;10;0;0;0;
655;Mens Tough Puff Hoody;https://flyhouse.pl/pl/kurtki/men-s-tough-puff-hoody.html#/347-rozmiar-s/409-kolor_odziezy-czarny;66;https://flyhouse.pl/2547-large_default/men-s-tough-puff-hoody.jpg,https://flyhouse.pl/2548-large_default/men-s-tough-puff-hoody.jpg,;Men's Tough Puff Hoody;1125.00;;;1;1;1;1;10;0;0;0;
656;Spodnie ocieplane pod wodery Orvis PRO HD Underwader Pants;https://flyhouse.pl/pl/strona-glowna/spodnie-ocieplane-pod-wodery-orvis-pro-hd-underwader-pants.html#/479-rozmiar_spodni-m;67;https://flyhouse.pl/3618-large_default/spodnie-ocieplane-pod-wodery-orvis-pro-hd-underwader-pants.jpg,https://flyhouse.pl/3619-large_default/spodnie-ocieplane-pod-wodery-orvis-pro-hd-underwader-pants.jpg,;Grubsza i cieplejsza wersja spodni Orvis PRO LT Underwader na zimę. Ogromne zatrzymywanie ciepła dzięki wnętrzu z polaru o długim włosiu. Odporna na ścieranie technologia antypilingowa Hardface. Łatwe do zakładania paski na stopy o niskim profilu zapobiegają podciąganiu się spodni. Regulujące ciepło 10-calowe boczne otwory wentylacyjne z siateczki YKK®. Pełny elastyczny pas z szlufkami na pasek. Dwie kieszenie boczne i tylna kieszeń bezpieczeństwa z zamkiem YKK®;745.00;;;1;1;1;1;10;0;0;0;
657;Spodnie ocieplane pod wodery Orvis PRO Light Underwader Pants;https://flyhouse.pl/pl/strona-glowna/spodnie-ocieplane-pod-wodery-orvis-pro-light-underwader-pants-.html#/479-rozmiar_spodni-m;67;https://flyhouse.pl/3611-large_default/spodnie-ocieplane-pod-wodery-orvis-pro-light-underwader-pants-.jpg,https://flyhouse.pl/3612-large_default/spodnie-ocieplane-pod-wodery-orvis-pro-light-underwader-pants-.jpg,;Lżejsza wersja niezwykle popularnych spodni Orvis PRO Underwader, idealna na wiosnę i jesień. Wygodny, regularny krój ze zwężaną nogawką. Łatwo się zakłada i zdejmuje dzięki wytrzymałej, odpornej na ścieranie zewnętrznej stronie. Ciepłe, ale nie za ciepłe, z lekkim polarem odprowadzającym wilgoć. Niepotrzebna objętość na dolnej części nogawki jest eliminowana przez lekki elastyczny panel na dolnym brzegu. Tkanina na dolnej części nogawki nie podjeżdża już i nie plącze się, dzięki wygodnym paskom strzemion. Twój portfel pozostaje na swoim miejscu, a dłonie pozostają ciepłe dzięki tylnej kieszeni zapinanej na zamek i dwóm przednim kieszeniom. Wygodna, elastyczna taśma z szlufkami na pasek. Trwałe, wodoodporne wykończenie.;595.00;;;1;1;1;1;10;0;0;0;
